{
  "schemaVersion": "1.0.0",
  "id": "intergroup-demand-consolidated-v2",
  "sourceDescription": "Normalized from the post-BHM-annotation intergroup_demand_consolidated_v2 table embedded in the Schedule 6 legacy planning script.",
  "records": [
    {
      "groups": [
        "APP",
        "CGI"
      ],
      "rating": 4,
      "qualifiedHubs": [
        "DAY",
        "JAX",
        "PHF"
      ],
      "passengersPerDay": 1371
    },
    {
      "groups": [
        "APP",
        "FLP"
      ],
      "rating": 5,
      "qualifiedHubs": [
        "DAY",
        "JAX"
      ],
      "passengersPerDay": 3595
    },
    {
      "groups": [
        "APP",
        "GCP"
      ],
      "rating": 2,
      "qualifiedHubs": [
        "DAY",
        "JAX"
      ],
      "passengersPerDay": 796
    },
    {
      "groups": [
        "APP",
        "GLC"
      ],
      "rating": 4,
      "qualifiedHubs": [
        "DAY"
      ],
      "passengersPerDay": 1601
    },
    {
      "groups": [
        "APP",
        "LEC"
      ],
      "rating": 2,
      "qualifiedHubs": [
        "DAY"
      ],
      "passengersPerDay": 634
    },
    {
      "groups": [
        "APP",
        "MAC"
      ],
      "rating": 2,
      "qualifiedHubs": [
        "DAY",
        "PHF",
        "SYR"
      ],
      "passengersPerDay": 447
    },
    {
      "groups": [
        "APP",
        "NEC"
      ],
      "rating": 2,
      "qualifiedHubs": [
        "DAY",
        "SYR"
      ],
      "passengersPerDay": 608
    },
    {
      "groups": [
        "APP",
        "OZK"
      ],
      "rating": 2,
      "qualifiedHubs": [
        "DAY",
        "MCI"
      ],
      "passengersPerDay": 453
    },
    {
      "groups": [
        "APP",
        "TEX"
      ],
      "rating": 4,
      "qualifiedHubs": [
        "DAY",
        "MCI"
      ],
      "passengersPerDay": 2107
    },
    {
      "groups": [
        "APP",
        "UMP"
      ],
      "rating": 2,
      "qualifiedHubs": [
        "DAY",
        "MCI"
      ],
      "passengersPerDay": 510
    },
    {
      "groups": [
        "CGI",
        "FLP"
      ],
      "rating": 5,
      "qualifiedHubs": [
        "JAX"
      ],
      "passengersPerDay": 4147
    },
    {
      "groups": [
        "CGI",
        "GCP"
      ],
      "rating": 3,
      "qualifiedHubs": [
        "JAX"
      ],
      "passengersPerDay": 1172
    },
    {
      "groups": [
        "CGI",
        "GLC"
      ],
      "rating": 5,
      "qualifiedHubs": [
        "DAY",
        "JAX",
        "PHF"
      ],
      "passengersPerDay": 2991
    },
    {
      "groups": [
        "CGI",
        "LEC"
      ],
      "rating": 4,
      "qualifiedHubs": [
        "DAY",
        "JAX",
        "PHF",
        "SYR"
      ],
      "passengersPerDay": 1642
    },
    {
      "groups": [
        "CGI",
        "MAC"
      ],
      "rating": 3,
      "qualifiedHubs": [
        "PHF"
      ],
      "passengersPerDay": 1083
    },
    {
      "groups": [
        "CGI",
        "NEC"
      ],
      "rating": 5,
      "qualifiedHubs": [
        "JAX",
        "PHF",
        "SYR"
      ],
      "passengersPerDay": 2398
    },
    {
      "groups": [
        "CGI",
        "OZK"
      ],
      "rating": 3,
      "qualifiedHubs": [
        "JAX",
        "MCI",
        "PHF"
      ],
      "passengersPerDay": 845
    },
    {
      "groups": [
        "CGI",
        "TEX"
      ],
      "rating": 5,
      "qualifiedHubs": [
        "JAX",
        "MCI",
        "PHF"
      ],
      "passengersPerDay": 2907
    },
    {
      "groups": [
        "CGI",
        "UMP"
      ],
      "rating": 3,
      "qualifiedHubs": [
        "JAX",
        "MCI",
        "PHF"
      ],
      "passengersPerDay": 892
    },
    {
      "groups": [
        "FLP",
        "GCP"
      ],
      "rating": 4,
      "qualifiedHubs": [
        "JAX"
      ],
      "passengersPerDay": 1780
    },
    {
      "groups": [
        "FLP",
        "GLC"
      ],
      "rating": 5,
      "qualifiedHubs": [
        "DAY",
        "JAX"
      ],
      "passengersPerDay": 8286
    },
    {
      "groups": [
        "FLP",
        "LEC"
      ],
      "rating": 5,
      "qualifiedHubs": [
        "DAY",
        "JAX",
        "SYR"
      ],
      "passengersPerDay": 5443
    },
    {
      "groups": [
        "FLP",
        "MAC"
      ],
      "rating": 5,
      "qualifiedHubs": [
        "JAX",
        "PHF",
        "SYR"
      ],
      "passengersPerDay": 3401
    },
    {
      "groups": [
        "FLP",
        "NEC"
      ],
      "rating": 5,
      "qualifiedHubs": [
        "JAX",
        "SYR"
      ],
      "passengersPerDay": 5939
    },
    {
      "groups": [
        "FLP",
        "OZK"
      ],
      "rating": 3,
      "qualifiedHubs": [
        "JAX",
        "MCI"
      ],
      "passengersPerDay": 1346
    },
    {
      "groups": [
        "FLP",
        "TEX"
      ],
      "rating": 5,
      "qualifiedHubs": [
        "JAX",
        "MCI"
      ],
      "passengersPerDay": 4702
    },
    {
      "groups": [
        "FLP",
        "UMP"
      ],
      "rating": 4,
      "qualifiedHubs": [
        "JAX",
        "MCI"
      ],
      "passengersPerDay": 2070
    },
    {
      "groups": [
        "GCP",
        "GLC"
      ],
      "rating": 4,
      "qualifiedHubs": [
        "DAY",
        "JAX"
      ],
      "passengersPerDay": 1468
    },
    {
      "groups": [
        "GCP",
        "LEC"
      ],
      "rating": 2,
      "qualifiedHubs": [
        "DAY",
        "JAX",
        "SYR"
      ],
      "passengersPerDay": 631
    },
    {
      "groups": [
        "GCP",
        "MAC"
      ],
      "rating": 2,
      "qualifiedHubs": [
        "JAX",
        "PHF",
        "SYR"
      ],
      "passengersPerDay": 519
    },
    {
      "groups": [
        "GCP",
        "NEC"
      ],
      "rating": 1,
      "qualifiedHubs": [
        "JAX",
        "SYR"
      ],
      "passengersPerDay": 427
    },
    {
      "groups": [
        "GCP",
        "OZK"
      ],
      "rating": 2,
      "qualifiedHubs": [
        "JAX",
        "MCI"
      ],
      "passengersPerDay": 582
    },
    {
      "groups": [
        "GCP",
        "TEX"
      ],
      "rating": 4,
      "qualifiedHubs": [
        "JAX",
        "MCI"
      ],
      "passengersPerDay": 2117
    },
    {
      "groups": [
        "GCP",
        "UMP"
      ],
      "rating": 2,
      "qualifiedHubs": [
        "JAX",
        "MCI"
      ],
      "passengersPerDay": 546
    },
    {
      "groups": [
        "GLC",
        "LEC"
      ],
      "rating": 3,
      "qualifiedHubs": [
        "DAY"
      ],
      "passengersPerDay": 1243
    },
    {
      "groups": [
        "GLC",
        "MAC"
      ],
      "rating": 3,
      "qualifiedHubs": [
        "DAY",
        "PHF",
        "SYR"
      ],
      "passengersPerDay": 1016
    },
    {
      "groups": [
        "GLC",
        "NEC"
      ],
      "rating": 3,
      "qualifiedHubs": [
        "DAY",
        "SYR"
      ],
      "passengersPerDay": 1055
    },
    {
      "groups": [
        "GLC",
        "OZK"
      ],
      "rating": 3,
      "qualifiedHubs": [
        "DAY",
        "MCI"
      ],
      "passengersPerDay": 981
    },
    {
      "groups": [
        "GLC",
        "TEX"
      ],
      "rating": 5,
      "qualifiedHubs": [
        "DAY",
        "MCI"
      ],
      "passengersPerDay": 4245
    },
    {
      "groups": [
        "GLC",
        "UMP"
      ],
      "rating": 3,
      "qualifiedHubs": [
        "DAY",
        "MCI"
      ],
      "passengersPerDay": 895
    },
    {
      "groups": [
        "LEC",
        "MAC"
      ],
      "rating": 1,
      "qualifiedHubs": [
        "SYR"
      ],
      "passengersPerDay": 251
    },
    {
      "groups": [
        "LEC",
        "NEC"
      ],
      "rating": 1,
      "qualifiedHubs": [
        "SYR"
      ],
      "passengersPerDay": 354
    },
    {
      "groups": [
        "LEC",
        "OZK"
      ],
      "rating": 1,
      "qualifiedHubs": [
        "DAY",
        "MCI",
        "SYR"
      ],
      "passengersPerDay": 358
    },
    {
      "groups": [
        "LEC",
        "TEX"
      ],
      "rating": 4,
      "qualifiedHubs": [
        "DAY",
        "MCI",
        "SYR"
      ],
      "passengersPerDay": 1566
    },
    {
      "groups": [
        "LEC",
        "UMP"
      ],
      "rating": 1,
      "qualifiedHubs": [
        "DAY",
        "MCI",
        "SYR"
      ],
      "passengersPerDay": 396
    },
    {
      "groups": [
        "MAC",
        "NEC"
      ],
      "rating": 1,
      "qualifiedHubs": [
        "SYR"
      ],
      "passengersPerDay": 421
    },
    {
      "groups": [
        "MAC",
        "OZK"
      ],
      "rating": 1,
      "qualifiedHubs": [
        "MCI",
        "PHF",
        "SYR"
      ],
      "passengersPerDay": 244
    },
    {
      "groups": [
        "MAC",
        "TEX"
      ],
      "rating": 3,
      "qualifiedHubs": [
        "MCI",
        "PHF",
        "SYR"
      ],
      "passengersPerDay": 1077
    },
    {
      "groups": [
        "MAC",
        "UMP"
      ],
      "rating": 1,
      "qualifiedHubs": [
        "MCI",
        "PHF",
        "SYR"
      ],
      "passengersPerDay": 231
    },
    {
      "groups": [
        "NEC",
        "OZK"
      ],
      "rating": 1,
      "qualifiedHubs": [
        "MCI",
        "SYR"
      ],
      "passengersPerDay": 240
    },
    {
      "groups": [
        "NEC",
        "TEX"
      ],
      "rating": 2,
      "qualifiedHubs": [
        "MCI",
        "SYR"
      ],
      "passengersPerDay": 730
    },
    {
      "groups": [
        "NEC",
        "UMP"
      ],
      "rating": 1,
      "qualifiedHubs": [
        "MCI",
        "SYR"
      ],
      "passengersPerDay": 255
    },
    {
      "groups": [
        "OZK",
        "TEX"
      ],
      "rating": 4,
      "qualifiedHubs": [
        "MCI"
      ],
      "passengersPerDay": 1422